{
  "schema_version": 1,
  "package_version": "0.1.0",
  "package_digest": "521632015e6853621cfc7c9cea7329fa4dbc57ecaf07e2ccef9bd987f7bc9ca5",
  "files": [
    {
      "source": "agents/domain-reviewer.toml",
      "target": ".codex/agents/domain-reviewer.toml",
      "sha256": "5d9fbe6872383e24e06e6aa7e5771d4594d27e88d16845fe12f7c71f89116e5c"
    },
    {
      "source": "agents/explorer.toml",
      "target": ".codex/agents/explorer.toml",
      "sha256": "3af4b8e986e0e8f440f001b9e5ce14ad1dd39d5f21c65ee9a2f6420e5e06d44a"
    },
    {
      "source": "agents/spec-reviewer.toml",
      "target": ".codex/agents/spec-reviewer.toml",
      "sha256": "64aa98bd20750360392993825630b6b1c2c7d2fb207e1e89f6ab104f65ee9a92"
    },
    {
      "source": "agents/standards-reviewer.toml",
      "target": ".codex/agents/standards-reviewer.toml",
      "sha256": "a1ab33da68145497dcc4bc3270fb8cbfb27daa830bb462ee92e64bffbfbbbe38"
    }
  ]
}
